{
  "apiVersion": "convoy.ai/v1alpha1",
  "kind": "World",
  "metadata": {
    "id": "aurelia-vendor-review",
    "name": "Aurelia Vendor Assurance",
    "version": "0.1.0",
    "description": "A resettable enterprise environment for security evidence collection, vendor risk synthesis, remediation, and human approval."
  },
  "scenario": {
    "id": "enterprise-vendor-security-review",
    "title": "Helix AI production vendor review",
    "instruction": "Collect security, privacy, and architecture evidence; mobilize remediation; write a risk memo; and route the production decision to a human."
  },
  "services": [
    {
      "capability": "chat",
      "local_provider": "convoy-sim",
      "production_candidates": ["zulip", "slack", "teams"]
    },
    {
      "capability": "evidence",
      "local_provider": "convoy-sim",
      "production_candidates": ["vanta", "drata", "secureframe"]
    },
    {
      "capability": "work",
      "local_provider": "convoy-sim",
      "production_candidates": ["plane", "jira", "servicenow"]
    },
    {
      "capability": "drive",
      "local_provider": "convoy-sim",
      "production_candidates": ["owncloud", "google-drive", "sharepoint"]
    }
  ],
  "human_actors": ["vinayaka"],
  "policies": {
    "external_outreach_requires_approval": true,
    "vendor_decision_requires_approval": true
  },
  "tools": [
    {
      "name": "chat.send",
      "description": "Send an internal or approved external message."
    },
    {
      "name": "evidence.attach",
      "description": "Attach sourced security, privacy, or architecture evidence."
    },
    {
      "name": "work.create_task",
      "description": "Create owned remediation work."
    },
    {
      "name": "drive.write_document",
      "description": "Write the vendor risk memo."
    },
    {
      "name": "approval.request",
      "description": "Request a human vendor decision."
    },
    {
      "name": "approval.resolve",
      "description": "Resolve a gate as a designated human."
    },
    {
      "name": "decision.record",
      "description": "Record the final vendor decision after approval."
    }
  ],
  "evaluation": {
    "module": "./evaluator.mjs",
    "pass_score": 80
  }
}
