{
  "apiVersion": "convoy.ai/v1alpha1",
  "kind": "World",
  "metadata": {
    "id": "aurelia-vendor-assurance",
    "name": "Aurelia Portfolio Vendor Assurance",
    "version": "0.1.0",
    "description": "A deterministic 50-vendor enterprise environment for parallel evidence review, exception discovery, remediation, and governed risk acceptance."
  },
  "scenario": {
    "id": "portfolio-vendor-assurance",
    "title": "Quarterly production-vendor assurance campaign",
    "instruction": "Review every in-scope production vendor, validate security, privacy, architecture, and legal evidence, create accountable remediation for every real exception, and route material risks to designated humans."
  },
  "services": [
    {
      "capability": "vendor_registry",
      "local_provider": "convoy-sim",
      "production_candidates": ["servicenow", "zip", "coupa"]
    },
    {
      "capability": "evidence",
      "local_provider": "convoy-sim",
      "production_candidates": ["vanta", "drata", "secureframe"]
    },
    {
      "capability": "work",
      "local_provider": "convoy-sim",
      "production_candidates": ["plane", "jira", "servicenow"]
    },
    {
      "capability": "drive",
      "local_provider": "convoy-sim",
      "production_candidates": ["owncloud", "google-drive", "sharepoint"]
    },
    {
      "capability": "approval",
      "local_provider": "convoy-sim",
      "production_candidates": ["convoy", "slack", "teams"]
    }
  ],
  "human_actors": ["vinayaka", "person-priya"],
  "policies": {
    "external_outreach_requires_approval": true,
    "critical_vendor_exception_requires_approval": true,
    "evidence_must_reference_source_artifacts": true,
    "agent_cannot_resolve_approval": true
  },
  "tools": [
    {
      "name": "vendor.list",
      "description": "List in-scope vendors, optionally filtered by criticality or review status."
    },
    {
      "name": "vendor.read",
      "description": "Read one vendor with its requirements, evidence, findings, exceptions, and remediation work."
    },
    {
      "name": "evidence.search",
      "description": "Search source evidence by vendor, requirement, or assurance domain."
    },
    {
      "name": "evidence.record_finding",
      "description": "Record a source-grounded valid, missing, stale, or contradictory evidence finding."
    },
    {
      "name": "exception.create",
      "description": "Create a governed vendor exception from a recorded non-valid evidence finding."
    },
    {
      "name": "work.create_task",
      "description": "Create owned remediation work for a vendor exception."
    },
    {
      "name": "drive.write_document",
      "description": "Create the portfolio assurance report or another shared artifact."
    },
    {
      "name": "approval.request",
      "description": "Request human acceptance of a material vendor exception."
    },
    {
      "name": "approval.resolve",
      "description": "Resolve a pending gate as a designated human."
    }
  ],
  "evaluation": {
    "module": "./evaluator.mjs",
    "pass_score": 90
  }
}
