{
  "apiVersion": "convoy.ai/v1alpha1",
  "kind": "World",
  "metadata": {
    "id": "aurelia-renewal-ops",
    "name": "Aurelia Revenue Operations",
    "version": "0.1.0",
    "description": "A resettable company environment for renewal interventions, internal coordination, and gated forecast changes."
  },
  "scenario": {
    "id": "enterprise-renewal-recovery",
    "title": "Enterprise renewal recovery campaign",
    "instruction": "Identify every high-risk enterprise renewal, coordinate the recovery motion, create accountable work, write an executive brief, and route consequential forecast changes to a human."
  },
  "services": [
    {
      "capability": "chat",
      "local_provider": "convoy-sim",
      "production_candidates": ["zulip", "slack", "teams"]
    },
    {
      "capability": "crm",
      "local_provider": "convoy-sim",
      "production_candidates": ["twenty", "salesforce", "hubspot"]
    },
    {
      "capability": "work",
      "local_provider": "convoy-sim",
      "production_candidates": ["plane", "jira", "servicenow"]
    },
    {
      "capability": "drive",
      "local_provider": "convoy-sim",
      "production_candidates": ["owncloud", "google-drive", "sharepoint"]
    }
  ],
  "human_actors": ["vinayaka"],
  "policies": {
    "forecast_change_human_gate_usd": 250000,
    "external_outreach_requires_approval": true
  },
  "tools": [
    {
      "name": "chat.send",
      "description": "Send an internal or approved external message."
    },
    {
      "name": "crm.update_account",
      "description": "Update account state subject to forecast policy."
    },
    {
      "name": "work.create_task",
      "description": "Create owned recovery work."
    },
    {
      "name": "drive.write_document",
      "description": "Create an artifact in the shared drive."
    },
    {
      "name": "approval.request",
      "description": "Request a human decision."
    },
    {
      "name": "approval.resolve",
      "description": "Resolve a gate as a designated human."
    }
  ],
  "evaluation": {
    "module": "./evaluator.mjs",
    "pass_score": 80
  }
}
